{
  "orisCode": 0.0,
  "facilityName": "EPA Facility",
  "monPlanId": "12345",
  "locationInfo": "string",
  "testSumId": "12345",
  "systemComponentId": "12345",
  "testTypeCode": "string",
  "testNum": "string",
  "beginDate": "string",
  "endDate": "string",
  "userId": "12345",
  "updateDate": "string",
  "evalStatusCode": "active",
  "submissionAvailabilityCode": "string",
  "evalStatusCodeDescription": "active",
  "severityCode": "string",
  "severityDescription": "string",
  "submissionCodeDescription": "string",
  "periodAbbreviation": "string"
}